{
  "task_id": "AXX-RUN-W1-SQL_DATA",
  "run_id": "AXX-YYYYMMDD-HHMMSS",
  "app_id": "AXX",
  "role": "sql_data",
  "work_package_id": "WP_AXX_SQL_DATA",
  "work_package_digest": "0123456789abcdef0123456789abcdef0123456789abcdef0123456789abcdef",
  "produced_revision": null,
  "validation_results": [
    {
      "command": "python -m pytest plugins/ak/tests/test_collaboration_review.py -q",
      "exit_code": 0,
      "result": "PASS"
    }
  ],
  "review_receipt_required": true,
  "agent_runtime": "generic",
  "agent_id": "worker-agent-id",
  "status": "COMPLETED",
  "summary": "Short evidence-backed summary.",
  "artifacts": ["work/sql_data/result.json"],
  "evidence_ids": ["AXX-P1-SQL_DATA-001"],
  "gaps": [],
  "conflict_ids": [],
  "source_files_read": ["sources/sql/schema.sql"],
  "input_tokens": null,
  "output_tokens": null,
  "completed_at": "2000-01-01T00:00:00+00:00"
}
